{
    "id": "IH4aFVPJ4GgocNKRt3xho80V",
    "owner": "Hershel Ferry",
    "roles": "networks, systems",
    "name": "Leuschke - Runolfsson",
    "description": "zero defect",
    "startDate": "2014-10-26T03:13:12.221Z",
    "endDate": "2016-10-10T02:11:57.306Z",
    "creationDate": "2014-11-15T22:09:41.139Z",
    "version": "1.53"
}